{
  "schema_version": "2.0",
  "project_id": "61111111-1111-4111-8111-111111111111",
  "revision": 0,
  "global": {
    "primary_genre": "light electronic ambient",
    "fusion_genres": ["minimal cinematic"],
    "primary_mood": "focused and quietly optimistic",
    "secondary_moods": [],
    "tempo_mode": "medium",
    "bpm": null,
    "key": null,
    "energy": "steady build with a brief mid-section reduction",
    "imagery": ["a workshop waking up in early morning light"],
    "production": ["clean modern electronic texture", "controlled low-end pulse"],
    "custom_notes": "Instrumental piece for a one-minute process video"
  },
  "vocal": {
    "mode": "instrumental",
    "lead": null,
    "timbre": [],
    "delivery": [],
    "harmony": [],
    "effects": []
  },
  "arrangement": {
    "template_id": null,
    "primary_layers": ["short synth phrases carry the lead melody"],
    "secondary_layers": ["sparse glockenspiel accents appear near transitions"],
    "foundation": ["soft electronic drums and a restrained bass pulse"],
    "transitions": ["brief filter reduction at the midpoint", "clean final reduction without a dramatic hit"],
    "section_development": []
  }
}
