{
  "schema_version": "2.0",
  "project_id": "11111111-1111-4111-8111-111111111111",
  "revision": 0,
  "global": {
    "primary_genre": "warm acoustic folk-pop",
    "fusion_genres": [],
    "primary_mood": "warm and reassuring",
    "secondary_moods": ["restrained nostalgia"],
    "tempo_mode": "medium",
    "bpm": null,
    "key": null,
    "energy": "gentle opening, gradual lift, quiet resolution",
    "imagery": ["a lit window seen on the way home"],
    "production": ["intimate natural room sound", "clear vocal with restrained dynamics"],
    "custom_notes": "Keep the arrangement spacious enough for a family video"
  },
  "vocal": {
    "mode": "vocal",
    "lead": "warm male lead",
    "timbre": ["natural", "close and reassuring"],
    "delivery": ["Mandarin", "conversational verses", "slightly fuller chorus"],
    "harmony": ["subtle backing harmony in the final chorus"],
    "effects": ["short natural reverb"]
  },
  "arrangement": {
    "template_id": null,
    "primary_layers": ["fingerpicked acoustic guitar carries the verses", "soft piano supports the chorus"],
    "secondary_layers": ["restrained strings enter after the first chorus"],
    "foundation": ["light percussion with a relaxed steady pulse"],
    "transitions": ["brief guitar fill into the chorus", "instruments thin out before the final line"],
    "section_development": []
  }
}
